<?xml version="1.0" encoding="UTF-8"?> 
<experiment xmlns="http://per-colator.com/percolator_in/10" xmlns:xsi="http://www.w3.org/2001/XMLSchema-instance" xsi:schemaLocation="http://per-colator.com/percolator_in/10 http://github.com/percolator/percolator/raw/master/src/xml/percolator_in.xsd"> 

<enzyme>trypsin</enzyme>

<process_info>
  <command_line>/scratch/temp/percolatorBuild/src/converters/sqt2pin -o /scratch/temp/bin/data/percolator_test/retention/pin.xml -2 /scratch/behemot_public/ms2/elude_apex_data/xml/target/Celegans_Jupter_C12_60min_grad.ms2 /scratch/behemot_public/ms2/elude_apex_data/xml/target/Celegans_Jupter_C12_60min_grad.sqt /scratch/behemot_public/ms2/elude_apex_data/xml/decoy/Celegans_Jupter_C12_60min_grad.sqt</command_line>
</process_info>

<featureDescriptions xmlns="http://per-colator.com/percolator_in/10">

  <featureDescription name="lnrSp"/>

  <featureDescription name="deltLCn"/>

  <featureDescription name="deltCn"/>

  <featureDescription name="Xcorr"/>

  <featureDescription name="Sp"/>

  <featureDescription name="IonFrac"/>

  <featureDescription name="Mass"/>

  <featureDescription name="PepLen"/>

  <featureDescription name="Charge1"/>

  <featureDescription name="Charge2"/>

  <featureDescription name="Charge3"/>

  <featureDescription name="Charge4"/>

  <featureDescription name="Charge5"/>

  <featureDescription name="enzN"/>

  <featureDescription name="enzC"/>

  <featureDescription name="enzInt"/>

  <featureDescription name="lnNumSP"/>

  <featureDescription name="dM"/>

  <featureDescription name="absdM"/>

</featureDescriptions>
<fragSpectrumScan xmlns="http://per-colator.com/percolator_in/10" experimentalMassToCharge="1133.5383" scanNumber="888">

  <peptideSpectrumMatch calculatedMassToCharge="1133.537" chargeState="2" experimentalMassToCharge="1133.5383" id="Celegans_Jupter_C12_60min_grad_888_2_1" isDecoy="false" observedTime="10.0921001434326">
    <features>
      <feature>0.693147180559945</feature>
      <feature>0.313942011104257</feature>
      <feature>0.211782850092535</feature>
      <feature>1.621</feature>
      <feature>185.7</feature>
      <feature>0.5</feature>
      <feature>1133.5383</feature>
      <feature>10</feature>
      <feature>0</feature>
      <feature>1</feature>
      <feature>0</feature>
      <feature>0</feature>
      <feature>0</feature>
      <feature>1</feature>
      <feature>1</feature>
      <feature>0</feature>
      <feature>9.78942259624815</feature>
      <feature>0.000649999999950523</feature>
      <feature>0.000649999999950523</feature>
    </features>
    <peptide>
      <peptideSequence>VMNTNIDGNR</peptideSequence>
    </peptide>
    <occurence flankC="K" flankN="R" proteinId="Y57G11C.16"/>
  </peptideSpectrumMatch>

  <peptideSpectrumMatch calculatedMassToCharge="1129.556" chargeState="2" experimentalMassToCharge="1129.5503" id="Celegans_Jupter_C12_60min_grad_888_2_1" isDecoy="false" observedTime="10.0921001434326">
    <features>
      <feature>4.06044301054642</feature>
      <feature>0.519929344904385</feature>
      <feature>0.059826434221642</feature>
      <feature>1.3021</feature>
      <feature>74.2</feature>
      <feature>0.333333333333333</feature>
      <feature>1129.5503</feature>
      <feature>10</feature>
      <feature>0</feature>
      <feature>1</feature>
      <feature>0</feature>
      <feature>0</feature>
      <feature>0</feature>
      <feature>0</feature>
      <feature>0</feature>
      <feature>0</feature>
      <feature>9.63200685942236</feature>
      <feature>-0.00284999999996671</feature>
      <feature>0.00284999999996671</feature>
    </features>
    <peptide>
      <peptideSequence>LINVMEAPNE</peptideSequence>
    </peptide>
    <occurence flankC="G" flankN="H" proteinId="Y71G12B.11a"/>
    <occurence flankC="G" flankN="H" proteinId="Y71G12B.11b"/>
  </peptideSpectrumMatch>

  <peptideSpectrumMatch calculatedMassToCharge="1133.543" chargeState="2" experimentalMassToCharge="1133.5383" id="Celegans_Jupter_C12_60min_grad_888_2_1" isDecoy="true" observedTime="10.0921001434326">
    <features>
      <feature>0</feature>
      <feature>0.139170506912442</feature>
      <feature>0.0541145490454245</feature>
      <feature>1.519</feature>
      <feature>200.2</feature>
      <feature>0.5</feature>
      <feature>1133.5383</feature>
      <feature>10</feature>
      <feature>0</feature>
      <feature>1</feature>
      <feature>0</feature>
      <feature>0</feature>
      <feature>0</feature>
      <feature>1</feature>
      <feature>1</feature>
      <feature>1</feature>
      <feature>9.78942259624815</feature>
      <feature>-0.00234999999997854</feature>
      <feature>0.00234999999997854</feature>
    </features>
    <peptide>
      <peptideSequence>DDNTEVNAKK</peptideSequence>
    </peptide>
    <occurence flankC="E" flankN="R" proteinId="random_seq_20815"/>
  </peptideSpectrumMatch>

  <peptideSpectrumMatch calculatedMassToCharge="1129.548" chargeState="2" experimentalMassToCharge="1129.5503" id="Celegans_Jupter_C12_60min_grad_888_2_1" isDecoy="true" observedTime="10.0921001434326">
    <features>
      <feature>4.45434729625351</feature>
      <feature>0.577719528178244</feature>
      <feature>0.071384884228921</feature>
      <feature>1.1445</feature>
      <feature>65.4</feature>
      <feature>0.277777777777778</feature>
      <feature>1129.5503</feature>
      <feature>10</feature>
      <feature>0</feature>
      <feature>1</feature>
      <feature>0</feature>
      <feature>0</feature>
      <feature>0</feature>
      <feature>1</feature>
      <feature>0</feature>
      <feature>1</feature>
      <feature>9.63200685942236</feature>
      <feature>0.00115000000005239</feature>
      <feature>0.00115000000005239</feature>
    </features>
    <peptide>
      <peptideSequence>IINPDRDASE</peptideSequence>
    </peptide>
    <occurence flankC="S" flankN="R" proteinId="random_seq_27504"/>
    <occurence flankC="S" flankN="R" proteinId="random_seq_27505"/>
  </peptideSpectrumMatch>

</fragSpectrumScan>
<fragSpectrumScan xmlns="http://per-colator.com/percolator_in/10" experimentalMassToCharge="1014.5236" scanNumber="890">

  <peptideSpectrumMatch calculatedMassToCharge="1014.525" chargeState="2" experimentalMassToCharge="1014.5236" id="Celegans_Jupter_C12_60min_grad_890_2_1" isDecoy="false" observedTime="10.8540000915527">
    <features>
      <feature>4.82028156560504</feature>
      <feature>0.197354416907404</feature>
      <feature>0.0275201459632051</feature>
      <feature>1.3154</feature>
      <feature>92.4</feature>
      <feature>0.388888888888889</feature>
      <feature>1014.5236</feature>
      <feature>10</feature>
      <feature>0</feature>
      <feature>1</feature>
      <feature>0</feature>
      <feature>0</feature>
      <feature>0</feature>
      <feature>0</feature>
      <feature>0</feature>
      <feature>0</feature>
      <feature>9.79082264687866</feature>
      <feature>-0.000699999999994816</feature>
      <feature>0.000699999999994816</feature>
    </features>
    <peptide>
      <peptideSequence>FEIGAPQGPV</peptideSequence>
    </peptide>
    <occurence flankC="Q" flankN="T" proteinId="W04G3.2"/>
  </peptideSpectrumMatch>

  <peptideSpectrumMatch calculatedMassToCharge="1014.521" chargeState="2" experimentalMassToCharge="1014.5236" id="Celegans_Jupter_C12_60min_grad_890_2_1" isDecoy="true" observedTime="10.8540000915527">
    <features>
      <feature>2.70805020110221</feature>
      <feature>0.436089030206677</feature>
      <feature>0.0692368839427663</feature>
      <feature>1.258</feature>
      <feature>133.3</feature>
      <feature>0.5</feature>
      <feature>1014.5236</feature>
      <feature>9</feature>
      <feature>0</feature>
      <feature>1</feature>
      <feature>0</feature>
      <feature>0</feature>
      <feature>0</feature>
      <feature>0</feature>
      <feature>1</feature>
      <feature>0</feature>
      <feature>9.79082264687866</feature>
      <feature>0.00130000000001473</feature>
      <feature>0.00130000000001473</feature>
    </features>
    <peptide>
      <peptideSequence>EVADTQVPR</peptideSequence>
    </peptide>
    <occurence flankC="K" flankN="T" proteinId="random_seq_4989"/>
    <occurence flankC="K" flankN="T" proteinId="random_seq_5253"/>
    <occurence flankC="K" flankN="T" proteinId="random_seq_22729"/>
  </peptideSpectrumMatch>

</fragSpectrumScan>
<fragSpectrumScan xmlns="http://per-colator.com/percolator_in/10" experimentalMassToCharge="1263.6426" scanNumber="892">

  <peptideSpectrumMatch calculatedMassToCharge="1263.633" chargeState="2" experimentalMassToCharge="1263.6426" id="Celegans_Jupter_C12_60min_grad_892_2_1" isDecoy="false" observedTime="10.4176998138428">
    <features>
      <feature>3.25809653802148</feature>
      <feature>0.353951665578054</feature>
      <feature>0.0907250163291966</feature>
      <feature>1.531</feature>
      <feature>145.2</feature>
      <feature>0.5</feature>
      <feature>1263.6426</feature>
      <feature>10</feature>
      <feature>0</feature>
      <feature>1</feature>
      <feature>0</feature>
      <feature>0</feature>
      <feature>0</feature>
      <feature>0</feature>
      <feature>0</feature>
      <feature>2</feature>
      <feature>9.98026339133818</feature>
      <feature>0.00479999999993197</feature>
      <feature>0.00479999999993197</feature>
    </features>
    <peptide>
      <peptideSequence>KDNQKEQFVQ</peptideSequence>
    </peptide>
    <occurence flankC="L" flankN="L" proteinId="Y67H2A.7"/>
  </peptideSpectrumMatch>

  <peptideSpectrumMatch calculatedMassToCharge="1263.64" chargeState="2" experimentalMassToCharge="1263.6426" id="Celegans_Jupter_C12_60min_grad_892_2_1" isDecoy="true" observedTime="10.4176998138428">
    <features>
      <feature>1.38629436111989</feature>
      <feature>0.519977205090863</feature>
      <feature>0.0554042930412207</feature>
      <feature>1.5793</feature>
      <feature>190.9</feature>
      <feature>0.5</feature>